{
  "$schema": "http://json-schema.org/draft-07/schema#",
  "type": "object",
  "properties": {
    "$schema": {
      "type": "string"
    },
    "Bluesky": {
      "type": "string"
    },
    "Connect with us": {
      "type": "string"
    },
    "Count is {count}": {
      "anyOf": [
        {
          "type": "string"
        },
        {
          "additionalProperties": {
            "type": "string"
          },
          "type": "object"
        }
      ],
      "description": "Variables: {count}"
    },
    "Discord": {
      "type": "string"
    },
    "Documentation": {
      "type": "string"
    },
    "Edit <code>src/App.vue</code> and save to test <code>HMR</code>": {
      "type": "string"
    },
    "Explore Vite": {
      "type": "string"
    },
    "Get started": {
      "type": "string"
    },
    "GitHub": {
      "type": "string"
    },
    "Join the Vite community": {
      "type": "string"
    },
    "Learn more": {
      "type": "string"
    },
    "Vite logo": {
      "type": "string"
    },
    "Vue logo": {
      "type": "string"
    },
    "X.com": {
      "type": "string"
    },
    "Your questions, answered": {
      "type": "string"
    }
  },
  "required": [
    "Bluesky",
    "Connect with us",
    "Count is {count}",
    "Discord",
    "Documentation",
    "Edit <code>src/App.vue</code> and save to test <code>HMR</code>",
    "Explore Vite",
    "Get started",
    "GitHub",
    "Join the Vite community",
    "Learn more",
    "Vite logo",
    "Vue logo",
    "X.com",
    "Your questions, answered"
  ],
  "additionalProperties": false
}
